,Customer Name,Customer Phone No,Customer Id,Customer Address,Order Placed,Order Cancelled
0,Ram Rawoot,9019283823,BK8732Q09,"61 Site No,Kalka Complex, Dda Lsc st Floor,Kalkaji",4,1
1,Om Gera,8555437452,G1356E52,"296 , Nagdevi Street, Nagdevi, Mumbai",5,3
2,Rajnish Reddy,3332347934,GE6324F97,"B-23, Maitri Pk, S T Rd, Chembur",3,2
3,Ishaan Suresh,8398209841,JH9182O09,"22 /B, Hindu Colony, Opp.Sardar Patel Stadium Road, Navrangpura",1,0
4,Swarna Comar,9143852541,KS810Q87,"B M P Bldg, 2nd Floor N A Sawant Marg, Colaba",2,1
5,Saniya Chaturvedi,7128381271,LK4712Q67,"47, Daria Nagar House, Maharishi Karve Road, New Marine Lines",2,0
